{
  "task_id": "task-20260301-0001",
  "task_type": "inference",
  "input_hash": "aaaaaaaaaaaaaaaaaaaaaaaaaaaaaaaaaaaaaaaaaaaaaaaaaaaaaaaaaaaaaaaa",
  "model": {
    "model_id": "trnm-vision-base",
    "model_digest": "bbbbbbbbbbbbbbbbbbbbbbbbbbbbbbbbbbbbbbbbbbbbbbbbbbbbbbbbbbbbbbbb",
    "version": "v1.0.0"
  },
  "provenance": {
    "producer_did": "did:trnm:org:lane-dae",
    "produced_at": "2026-03-01T01:00:00Z",
    "privacy_tier": "internal"
  }
}
